{
  "$schema": "https://json-schema.org/draft/2020-12/schema",
  "$id": "urn:agent-archivist:schema:v1:occurrence-manifest",
  "title": "Agent Archivist raw occurrence manifest (occurrence_version 1)",
  "description": "The durable, source-stable provenance record for one occurrence (plan Sections 7.1, 7.4, and 7.5; STO-002, STO-010, STO-011; SID-005, SID-006). The server writes it as RFC 8785 canonical JSON at the deterministic occurrence key after the content-addressed blob is durable and before any upload attestation (plan Section 5, client data flow and server commit order). Every field is an input to, or a deterministic derivation of, the session, artifact, and occurrence identities, so the canonical bytes never vary by uploader or upload attempt (STO-010): uploader, request, transport, per-attempt authorization, and server commit material live in the upload attestation and the signed receipt, never here. The manifest is self-verifying — every derived value it carries (session_hash, artifact_hash, occurrence_id) is re-derivable from its own fields alone, so an auditor needs nothing but the object itself (STO-011). Unknown optional fields are retained and their semantics ignored (plan Section 7.1); the reserved names below are rejected outright because freezing uploader, request, transport, per-attempt, or server material in a source-stable record would break exactly the separation that keeps a relay from overwriting source provenance (SID-006; EC-05A; plan Section 3, decision on separate occurrence and attestation identity).",
  "type": "object",
  "x-archivist": {
    "mediaType": "application/vnd.agent-archivist.occurrence+json;version=1",
    "canonicalization": "rfc8785",
    "floats": false,
    "unknownFields": "retain-ignore",
    "objectKey": "schemas/v1/common.json#/$defs/occurrence-object-key",
    "writeOrder": "after the blob is durable, before any upload attestation (plan Section 7.5; RCPT-001 ordering)",
    "identityStability": "STO-010: canonical fields MUST NOT vary by uploader or upload attempt — every field below is source-stable by construction, being an identity-hash input or a deterministic derivation of identity-hash inputs",
    "deduplication": "STO-002: one manifest per distinct occurrence_id, including when several occurrences reference one blob",
    "reservedFields": [
      "attestation_id",
      "authorization_epoch",
      "authorization_key_id",
      "authorization_timestamp",
      "capture_time",
      "commit_time",
      "compressed_size",
      "correlation_id",
      "delegation",
      "envelope_creation_time",
      "incoming_checksum",
      "incoming_checksum_algorithm",
      "request_id",
      "signature",
      "transport_encoding",
      "uploader_client_id"
    ]
  },
  "required": [
    "adapter_artifact_id",
    "adapter_id",
    "adapter_projection_version",
    "artifact_hash",
    "artifact_kind",
    "blob_digest",
    "generation",
    "harness",
    "id_source",
    "occurrence_id",
    "occurrence_version",
    "origin_client_id",
    "range_end",
    "range_kind",
    "range_start",
    "session_hash",
    "storage_profile",
    "tenant_id",
    "upstream_session_id"
  ],
  "properties": {
    "occurrence_version": {
      "const": 1,
      "description": "Occurrence-manifest schema major version (plan Section 7.1 version axis `occurrence_version`). Integer, currently 1; readers retain old-version support. New optional fields land inside v1; new required fields, redefined fields, a changed canonical field set, or changed identity rules require v2.",
      "x-archivist": { "bearing": "security", "compat": "required-v1", "failClosed": true }
    },
    "occurrence_id": {
      "$ref": "urn:agent-archivist:schema:v1:common#/$defs/sha256-hex",
      "description": "The manifest's own deterministic identity (plan Section 7.4; SID-005): H(\"occurrence-v1\", session_hash, artifact_hash, generation, range_kind, range_start, range_end, blob_digest), constructed per schemas/v1/ingest-identifiers.json. Carried so the record is self-naming and re-derivable in place: an audit recomputes it from this manifest's own fields and refuses a mismatch (STO-011; VAL-005; PI-07 containment — fabrication creates new attributed objects, never corrupts archived ones).",
      "x-archivist": { "bearing": "identity", "compat": "required-v1" }
    },
    "tenant_id": {
      "$ref": "urn:agent-archivist:schema:v1:common#/$defs/uuid-v4",
      "description": "Issuer-created tenant identifier (plan Section 7.4). Scopes the object key and every derived identity below; cross-tenant writes are denied before any key is derived (SEC-003).",
      "x-archivist": { "bearing": "identity", "compat": "required-v1" }
    },
    "origin_client_id": {
      "$ref": "urn:agent-archivist:schema:v1:common#/$defs/uuid-v4",
      "description": "The installation that captured the source (STO-010 requires origin in the manifest). Namespaces the logical session together with tenant, harness, and upstream session (SID-001); a relay uploader never replaces it with its own identity (ID-005; EC-05A) — who presented an upload is attestation material only.",
      "x-archivist": { "bearing": "identity", "compat": "required-v1" }
    },
    "harness": {
      "$ref": "urn:agent-archivist:schema:v1:common#/$defs/short-token",
      "description": "Harness identifier (plan Section 7.4 grammar). A session-identity input; the object key carries it as a validated opaque token.",
      "x-archivist": { "bearing": "identity", "compat": "required-v1" }
    },
    "upstream_session_id": {
      "$ref": "urn:agent-archivist:schema:v1:common#/$defs/opaque-id",
      "description": "The harness's own session identifier, or the adapter-minted stand-in when `id_source` is `synthetic`, retained verbatim (SID-006: importers and mirrors preserve original provenance). Object keys hash it and never embed it (plan Section 7.5); the manifest, living in the encrypted/restricted raw namespace (SEC-002), keeps the original so the archive stays self-describing. Opaque UTF-8, never case-folded or Unicode-normalized.",
      "x-archivist": { "bearing": "identity", "compat": "required-v1" }
    },
    "id_source": {
      "$ref": "urn:agent-archivist:schema:v1:common#/$defs/id-source",
      "description": "Whether `upstream_session_id` was read from the harness (`upstream`) or adapter-minted for a missing harness session ID (`synthetic`, never inferred from a path name) — plan Section 7.4. Durably recorded so a synthetic ID is never later mistaken for harness-issued provenance.",
      "x-archivist": { "bearing": "identity", "compat": "required-v1" }
    },
    "session_hash": {
      "$ref": "urn:agent-archivist:schema:v1:common#/$defs/sha256-hex",
      "description": "H(\"session-v1\", tenant_id, origin_client_id, harness, upstream_session_id) per schemas/v1/ingest-identifiers.json (plan Section 7.4; SID-001). Namespaces the session — cloned harness UUIDs under a second origin client derive a distinct hash and never merge (SID-002; EC-03). Carried so catalogs group occurrences by logical session without re-deriving the hash from the wire envelope, which is not stored.",
      "x-archivist": { "bearing": "identity", "compat": "required-v1" }
    },
    "artifact_kind": {
      "$ref": "urn:agent-archivist:schema:v1:common#/$defs/artifact-kind",
      "description": "Kind of source artifact (plan Section 7.3): `file-slice` (exact complete-record byte slice) or `database-projection` (versioned allowlisted projection). An artifact-identity input, and the interpretive frame for the range coordinates below.",
      "x-archivist": { "bearing": "identity", "compat": "required-v1" }
    },
    "adapter_id": {
      "$ref": "urn:agent-archivist:schema:v1:common#/$defs/short-token",
      "description": "The adapter that projected the artifact; an artifact-identity input (plan Section 7.4).",
      "x-archivist": { "bearing": "identity", "compat": "required-v1" }
    },
    "adapter_projection_version": {
      "$ref": "urn:agent-archivist:schema:v1:common#/$defs/version-token",
      "description": "Version of the adapter's projection (plan Section 7.1 adapter-projection version axis; STO-010 requires the adapter/projection version in the manifest). Preserved verbatim in provenance — a projection change is a different artifact, never a silent rewrite.",
      "x-archivist": { "bearing": "identity", "compat": "required-v1" }
    },
    "adapter_artifact_id": {
      "$ref": "urn:agent-archivist:schema:v1:common#/$defs/opaque-id",
      "description": "The adapter's opaque identifier for the source artifact; the last artifact-identity input (plan Section 7.4). The wire envelope is not durable, so without this field the artifact's identity would survive only as an unrecoverable hash input; storing it keeps the manifest sufficient to rebuild catalogs (STO-011).",
      "x-archivist": { "bearing": "identity", "compat": "required-v1" }
    },
    "artifact_hash": {
      "$ref": "urn:agent-archivist:schema:v1:common#/$defs/sha256-hex",
      "description": "H(\"artifact-v1\", session_hash, artifact_kind, adapter_id, adapter_projection_version, adapter_artifact_id) per schemas/v1/ingest-identifiers.json (plan Section 7.4). Generation-stable by construction: replacement, truncation, or incompatible rewrite starts a fresh `generation` under the same artifact hash, preserving both histories (SID-003; EC-02).",
      "x-archivist": { "bearing": "identity", "compat": "required-v1" }
    },
    "generation": {
      "$ref": "urn:agent-archivist:schema:v1:common#/$defs/uuid-v7",
      "description": "The source generation of this artifact snapshot (plan Sections 7.3 and 7.4): a UUIDv7 frozen when the generation was detected. An occurrence-identity input — a re-declared range under a new generation is a new occurrence, not an overwrite (SID-003).",
      "x-archivist": { "bearing": "identity", "compat": "required-v1" }
    },
    "range_kind": {
      "$ref": "urn:agent-archivist:schema:v1:common#/$defs/range-kind",
      "description": "Whether the coordinates below are byte offsets (`file-slice`) or projected-event ordinals (`database-projection`) — plan Section 7.4; SID-004's byte/event range and ordering information.",
      "x-archivist": { "bearing": "identity", "compat": "required-v1" }
    },
    "range_start": {
      "$ref": "urn:agent-archivist:schema:v1:common#/$defs/u63",
      "description": "Inclusive start coordinate of this chunk in the generation's source stream (STO-010 source coordinates). Declared ranges are the uploader's assertion (PI-07); `range_start` at most `range_end` is server-side validation (VAL-002), not schema syntax.",
      "x-archivist": { "bearing": "identity", "compat": "required-v1" }
    },
    "range_end": {
      "$ref": "urn:agent-archivist:schema:v1:common#/$defs/u63",
      "description": "Inclusive end coordinate of this chunk. Inside the occurrence identity (plan Section 7.4), so overlapping, gapped, split, or re-declared ranges produce distinct deterministic occurrences rather than corrupting one another (PI-05).",
      "x-archivist": { "bearing": "identity", "compat": "required-v1" }
    },
    "blob_digest": {
      "$ref": "urn:agent-archivist:schema:v1:common#/$defs/sha256-hex",
      "description": "SHA-256 of the canonical uncompressed payload bytes — the one digest that names a blob (STO-001; plan Section 7.4). Several manifests may carry the same value: identical bytes under distinct session namespaces is one tenant-scoped blob plus distinct occurrences, which is deduplication working, not a conflict (STO-002; plan Section 3, same-bytes scenario). The stored blob's uncompressed size is recoverable from its `zstd-v1` frame header, so no size field is duplicated here.",
      "x-archivist": { "bearing": "security", "compat": "required-v1" }
    },
    "storage_profile": {
      "$ref": "urn:agent-archivist:schema:v1:common#/$defs/storage-profile",
      "description": "The named canonical storage encoder of the blob this occurrence projects (plan Sections 7.5 and 7.6). Pins the stored form per occurrence so a later profile never rewrites the meaning of stored bytes under existing keys.",
      "x-archivist": { "bearing": "security", "compat": "required-v1" }
    },
    "source_time": {
      "$ref": "urn:agent-archivist:schema:v1:common#/$defs/rfc3339-utc-timestamp",
      "description": "Optional UTC event time embedded in or derived from the source itself, when one exists (plan Section 7.5 canonical occurrence fields). Omitted — never null — when the source carries none. Source-stable and uploader-asserted (PI-07): it describes the source, not any upload of it.",
      "x-archivist": { "bearing": "provenance", "compat": "optional-additive-v1" }
    }
  },
  "not": {
    "anyOf": [
      { "required": ["attestation_id"] },
      { "required": ["authorization_epoch"] },
      { "required": ["authorization_key_id"] },
      { "required": ["authorization_timestamp"] },
      { "required": ["capture_time"] },
      { "required": ["commit_time"] },
      { "required": ["compressed_size"] },
      { "required": ["correlation_id"] },
      { "required": ["delegation"] },
      { "required": ["envelope_creation_time"] },
      { "required": ["incoming_checksum"] },
      { "required": ["incoming_checksum_algorithm"] },
      { "required": ["request_id"] },
      { "required": ["signature"] },
      { "required": ["transport_encoding"] },
      { "required": ["uploader_client_id"] }
    ]
  }
}
