{"adapter_artifact_id":"session-file-4f9c2f1e","adapter_id":"claude-jsonl","adapter_projection_version":"2","artifact_hash":"46f2b786810ba131a442a7e5cae632b8213132cdf0a704f2e5cdd01e822b7b96","artifact_kind":"file-slice","blob_digest":"33cb5534930ffe41c245b1f4b5c42872abbe668edb9da835314b414da5a690a6","generation":"1a079d80-7000-7000-8000-000000000051","harness":"claude-code","id_source":"upstream","occurrence_id":"ba7f20995e144e8d92d06b5668d7350932e4850494827c24054c4b1b52e08090","occurrence_version":1,"origin_client_id":"11111111-2222-4333-8444-555555555555","range_end":169,"range_kind":"byte","range_start":0,"session_hash":"b1be7353c6aae5eb945802a690ab0269120bcb292599d849bcb7e298867755a0","source_time":"2026-09-11T16:44:02Z","storage_profile":"zstd-v1","tenant_id":"0f1e2d3c-4b5a-4978-8a9b-0c1d2e3f4a5b","upstream_session_id":"4f9c2f1e-8a3d-4b67-9c2f-1e8a3d4b679c"}
